{
  "$schema": "https://json-schema.org/draft/2020-12/schema",
  "$id": "https://github.com/Len4m/browser-agent-v86-poc/schemas/vm-profile.schema.json",
  "title": "Browser Agent v86 VM profile",
  "description": "Schema for source VM profiles in vm/profiles/*.json. Profiles are consumed by scripts/setup/vm-profile-image.mjs to generate public v86 initramfs manifests.",
  "type": "object",
  "additionalProperties": false,
  "required": ["id"],
  "properties": {
    "$schema": {
      "type": "string",
      "description": "Optional editor hint pointing to this schema."
    },
    "id": {
      "type": "string",
      "minLength": 1,
      "pattern": "^[a-z0-9][a-z0-9.-]*$",
      "description": "Stable profile identifier. Used as manifest filename, selector value and build id prefix."
    },
    "name": {
      "type": "string",
      "minLength": 1,
      "description": "Human-readable profile name shown in the UI."
    },
    "description": {
      "type": "string",
      "description": "Short profile summary shown in the UI and generated manifests."
    },
    "type": {
      "type": "string",
      "enum": ["initramfs"],
      "description": "Profile boot mode. Current builder creates initramfs-based images."
    },
    "alpineVersion": {
      "type": "string",
      "pattern": "^[0-9]+\\.[0-9]+(\\.[0-9]+)?$",
      "description": "Alpine version used to select the minirootfs, for example 3.23.4."
    },
    "alpineBranch": {
      "type": "string",
      "pattern": "^v[0-9]+\\.[0-9]+$",
      "description": "Alpine repository branch, for example v3.23."
    },
    "arch": {
      "type": "string",
      "enum": ["x86"],
      "description": "Alpine architecture. v86 currently boots the 32-bit x86 profiles."
    },
    "output": {
      "type": "string",
      "minLength": 1,
      "pattern": "^(public/)?v86/images/.+\\.gz$",
      "description": "Output initramfs path relative to public/ or repository root."
    },
    "kernelOutput": {
      "type": "string",
      "minLength": 1,
      "pattern": "^(public/)?v86/images/.+",
      "description": "Output kernel path relative to public/ or repository root."
    },
    "minRamMb": {
      "type": "integer",
      "minimum": 64,
      "description": "Minimum RAM shown for this profile in MB. Real minimum must be validated manually."
    },
    "recommendedRamMb": {
      "type": "integer",
      "minimum": 64,
      "description": "Recommended RAM shown and applied by default in MB."
    },
    "recommendedVramMb": {
      "type": "integer",
      "minimum": 0,
      "description": "Recommended VRAM shown and applied by default in MB."
    },
    "defaultDisk": {
      "type": "string",
      "pattern": "^(initramfs|hda-[0-9]+)$",
      "description": "Default disk selector value. Use initramfs or one of the hda-* values supported by the UI."
    },
    "packages": {
      "type": "array",
      "uniqueItems": true,
      "items": {
        "type": "string",
        "minLength": 1,
        "pattern": "^[A-Za-z0-9_.:+-]+$"
      },
      "description": "Alpine packages installed into the exported rootfs before packing the initramfs."
    },
    "extraRepositories": {
      "type": "array",
      "uniqueItems": true,
      "items": {
        "type": "string",
        "minLength": 1,
        "pattern": "^https?://.+"
      },
      "description": "Extra APK repositories appended after the main/community repositories."
    },
    "firstBootCommands": {
      "type": "array",
      "items": {
        "type": "string",
        "minLength": 1
      },
      "description": "Shell commands written to /etc/browser-agent-firstboot.sh and executed during VM boot."
    },
    "buildCommands": {
      "type": "array",
      "items": {
        "type": "string",
        "minLength": 1
      },
      "description": "Shell commands executed by scripts/setup/vm-alpine-initramfs.sh against /rootfs during image generation."
    },
    "validationCommands": {
      "type": "array",
      "items": {
        "type": "string",
        "minLength": 1
      },
      "description": "Manual commands printed after build to validate the generated VM profile."
    },
    "bootMessage": {
      "type": "string",
      "minLength": 1,
      "description": "Message displayed on serial0 after first boot setup."
    },
    "notes": {
      "type": "array",
      "items": {
        "type": "string",
        "minLength": 1
      },
      "description": "Maintainer notes for profile-specific package/repository decisions."
    }
  }
}
