{
  "id": "alpine-pentest-web",
  "name": "Alpine Pentest Web",
  "description": "Imagen web pentest con curl, nano, nmap, ffuf, python3, nikto con SSL, httpx y wordlists web pequeñas de SecLists para pruebas en v86.",
  "type": "initramfs",
  "alpineVersion": "3.23.4",
  "alpineBranch": "v3.23",
  "arch": "x86",
  "output": "v86/images/profiles/alpine-pentest-web-initramfs.gz",
  "kernelOutput": "v86/images/alpine-vmlinuz-lts",
  "minRamMb": 1024,
  "recommendedRamMb": 1536,
  "packages": [
    "ca-certificates",
    "curl",
    "nano",
    "nmap",
    "ffuf",
    "python3",
    "py3-pip",
    "bind-tools",
    "iproute2",
    "tmux",
    "nikto",
    "httpx",
    "perl-net-ssleay",
    "perl-io-socket-ssl",
    "perl-mozilla-ca",
    "openssl"
  ],
  "firstBootCommands": [
    "update-ca-certificates >/tmp/update-ca-certificates.log 2>&1 || true"
  ],
  "buildCommands": [
    "rm -rf /rootfs/var/cache/apk/* /rootfs/tmp/* /rootfs/var/tmp/*",
    "rm -rf /rootfs/usr/share/man /rootfs/usr/share/doc /rootfs/usr/share/locale",
    "mkdir -p /rootfs/usr/share/seclists/Discovery/Web-Content /rootfs/usr/share/wordlists",
    "wget -qO /rootfs/usr/share/seclists/Discovery/Web-Content/common.txt https://raw.githubusercontent.com/danielmiessler/SecLists/master/Discovery/Web-Content/common.txt",
    "wget -qO /rootfs/usr/share/seclists/Discovery/Web-Content/quickhits.txt https://raw.githubusercontent.com/danielmiessler/SecLists/master/Discovery/Web-Content/quickhits.txt",
    "wget -qO /rootfs/usr/share/seclists/Discovery/Web-Content/raft-small-directories-lowercase.txt https://raw.githubusercontent.com/danielmiessler/SecLists/master/Discovery/Web-Content/raft-small-directories-lowercase.txt",
    "wget -qO /rootfs/usr/share/seclists/Discovery/Web-Content/raft-small-files.txt https://raw.githubusercontent.com/danielmiessler/SecLists/master/Discovery/Web-Content/raft-small-files.txt",
    "wget -qO /rootfs/usr/share/seclists/Discovery/Web-Content/raft-small-extensions-lowercase.txt https://raw.githubusercontent.com/danielmiessler/SecLists/master/Discovery/Web-Content/raft-small-extensions-lowercase.txt",
    "test -s /rootfs/usr/share/seclists/Discovery/Web-Content/common.txt",
    "test -s /rootfs/usr/share/seclists/Discovery/Web-Content/quickhits.txt",
    "test -s /rootfs/usr/share/seclists/Discovery/Web-Content/raft-small-directories-lowercase.txt",
    "test -s /rootfs/usr/share/seclists/Discovery/Web-Content/raft-small-files.txt",
    "test -s /rootfs/usr/share/seclists/Discovery/Web-Content/raft-small-extensions-lowercase.txt",
    "ln -sf /usr/share/seclists/Discovery/Web-Content/common.txt /rootfs/usr/share/wordlists/common.txt",
    "ln -sf /usr/share/seclists/Discovery/Web-Content/quickhits.txt /rootfs/usr/share/wordlists/quickhits.txt",
    "cat > /rootfs/usr/share/seclists/README-browser-agent.txt <<'EOF'\nSecLists subset included in Browser Agent Pentest Lite:\n- Discovery/Web-Content/common.txt\n- Discovery/Web-Content/quickhits.txt\n- Discovery/Web-Content/raft-small-directories-lowercase.txt\n- Discovery/Web-Content/raft-small-files.txt\n- Discovery/Web-Content/raft-small-extensions-lowercase.txt\n\nExample:\nffuf -u http://target/FUZZ -w /usr/share/seclists/Discovery/Web-Content/common.txt -t 5 -rate 20\nEOF",
    "cat > /rootfs/usr/share/seclists/README-browser-agent-web-tools.txt <<'EOF'\nAdditional web tools in Alpine Pentest Web:\n- nikto: classic web server checks. Example:\n  nikto -h http://target -nointeractive\n- httpx: fast HTTP probing / fingerprinting. Example:\n  echo http://target | httpx -title -tech-detect -status-code -follow-redirects -threads 5 -rate-limit 20\n\nRecommended in v86/wsnic: keep low concurrency/rate-limit.\nEOF"
  ],
  "validationCommands": [
    "tmux -V",
    "python3 --version",
    "nmap --version | head -n 1",
    "httpx -version || httpx -h | head -n 5",
    "nikto -Version || nikto -h | head -n 5",
    "perl -MNet::SSLeay -e 'print \"Net::SSLeay OK\\n\"'",
    "perl -MIO::Socket::SSL -e 'print \"IO::Socket::SSL OK\\n\"'",
    "perl -MMozilla::CA -e 'print \"Mozilla::CA OK\\n\"' || true",
    "nikto -h https://example.com -nointeractive -Tuning x -maxtime 15s || true",
    "ffuf -V || ffuf -h | head -n 5",
    "curl -I --max-time 8 https://example.com",
    "df -h",
    "free -m",
    "ls -lh /usr/share/seclists/Discovery/Web-Content",
    "wc -l /usr/share/seclists/Discovery/Web-Content/common.txt /usr/share/seclists/Discovery/Web-Content/quickhits.txt",
    "test -s /usr/share/seclists/Discovery/Web-Content/raft-small-directories-lowercase.txt"
  ],
  "bootMessage": "Browser Alpine Pentest Web ready: curl, nano, nmap, ffuf, python3, nikto SSL, httpx y SecLists web mini.",
  "recommendedVramMb": 8,
  "defaultDisk": "initramfs",
  "extraRepositories": [
    "https://dl-cdn.alpinelinux.org/alpine/v3.21/community",
    "https://dl-cdn.alpinelinux.org/alpine/edge/main",
    "https://dl-cdn.alpinelinux.org/alpine/edge/testing"
  ],
  "notes": [
    "nikto no aparece publicado para v3.23/community/x86 en el índice actual; se habilita v3.21/community para x86.",
    "httpx se instala desde edge/testing/x86 porque no está en v3.23 estable.",
    "Mantén baja la concurrencia en v86/wsnic.",
    "Nikto requiere módulos Perl SSL para HTTPS: perl-net-ssleay + perl-io-socket-ssl.",
    "Se habilita edge/main para los módulos Perl SSL x86 y edge/testing para httpx."
  ]
}
